60,Busan,South Korea,35,87,28,73,40,94,"South Korea's second-largest city, Busan, is home to the famous sandy shore of Haeundae Beach, located just steps away from the city skyline and home to the unique creations of the Haeundae Sand Festival in the summer. For a more colorful experience, visit the Gamcheon Culture Village with its rainbow-colored houses impossibly perched on a steep hillside, earning it the reputation of the Machu Picchu of Busan. There are plenty of places to explore Busan on foot—but perhaps the most thrilling is the Songdo Yonggung Suspension Bridge, which traces the ridge of a seaside cliff and extends over the water to loop around the uninhabited Dongseom Island."
59,Bejing,China,74,64,100,20,30,72,"One of the oldest cities on this list and outliving many dynasties, Beijing has preserved its extensive history while constantly growing and innovating. Even travelers who've never visited China are familiar with its sections of the Great Wall, Forbidden City, and Tiananmen Square—but these destinations are still breathtaking when seen in person. Another site would be a typical Beijing ""hutong""—crisscrossing lanes and alleys built during the Ming and Qing dynasties. These ancient hutongs are at risk of being replaced by modern-era cities and buildings, but they are the best way to glance into a traditional Beijing citizen's life. Visitors must also make it a priority to try Beijing's world-famous Peking duck. This historic Chinese dish is older than many cities, from purveyors like the QuanJuDe Duck House chain, which has operated since 1864."
58,Sapporo,Japan,72,75,54,64,10,51,"The Japanese city of Sapporo may be most famous for its namesake brew—which you can learn about, and even taste, at the Sapporo Beer Museum. But it's also the birthplace of a uniquely Japanese type of ramen—and while there are plenty of restaurants to taste authentic miso ramen soup, Aji no Sanpei is where it was reportedly invented. A feast for the eyes, the Sapporo Snow Festival is a wintertime destination for tourists and locals, who flock there annually to admire elaborate snow sculptures and ice carvings."
57,Antalya,Turkey,68,7,59,66,95,87,"The Turkish resort town of Antalya keeps breaking its own records with its influx of tourists—like the 15.37 million who visited the vacation hotspot from January 2023 to November 2023. With stunning beaches at every turn, the Düden waterfalls, with stunning limestone karst springs surrounding them, and the Köprülü Canyon National Park, a spectacular natural wonder that's perfect for trout fishing and whitewater rafting, the Mediterranean gem is a perfect family getaway."
56,Mexico City,Mexico,69,59,90,9,87,65,"Mexico City is so much more than Mexico's national capital—especially with its growing art scene, including the Mexico City Art Week. Wintertime brings eco-tourists to the area to witness the annual migration of monarch butterflies at nearby nature preserves and open spaces, and the autumn sees an influx of tourists for the annual Día de Los Muertos (Day of the Dead) festival and parade, which began in 2016. Venture off the beaten path to the Barrio Chino, a tiny Chinatown that tells a lesser-known history of Chinese immigration to North America and annually celebrates Lunar New Year as a public festival."
55,Valencia,Spain,57,106,39,65,17,18,"Behind Madrid and Barcelona, Spain's third-largest city, Valencia, mixes Mediterranean vibes and flavors, such as its world-famous paella, gothic monuments like La Lonja, The Silk Exchange, and the ultra-modern City of Arts and Sciences—Ciutat de les Arts i les Ciències—complex. There's even a legacy of Arab influence from when Muslims conquered the city in A.D. 714—still visible at landmarks like the Admiral's Baths and ruins of Arab-built city walls. Consider scheduling your trip during the Fallas festivities in March to catch all the pyrotechnics, performances, light shows, and puppets called ""ninots"" that get blown up in celebration of St. Joseph."
54,Sao Paulo,Brazil,80,104,32,6,96,52,"With a population of more than 22 million, São Paulo is the fourth-largest city in the world. It's also ground zero for Brazil's favorite sport, soccer—with an art deco-style ""football"" stadium, Estádio do Pacaembu, with its own soccer museum, Museu do Futebol. This Brazilian city is also positioned prominently on the world stage when it comes to theater. Its Theatro Municipal, inspired by the Palais Garnier in Paris, is open for tours when no shows are running. It truly is a global city, too—as it's home to the largest Japanese enclave in the world—outside of Japan—the Liberdade district."
53,Seville,Spain,75,99,14,74,19,11,"Live out your greatest Andalusian fantasies in Seville, Spain, where tourism has boomed in the 2020s. Among the treasures that visitors have discovered are its historic city center, tapas bars, and centuries-old landmarks like the Real Alcázar palace, Catedral de Sevilla—Europe's largest gothic-style building, and La Giralda, a tower from a mosque that was torn down in 1402. Escape the bustle by getting off the sidewalks and streets and heading onto the Guadalquivir River for a boat cruise through the heart of the city, past its many parks and with a view of its many ancient landmarks. Don't forget to take in a performance by flamenco dancers, some of whom perform on street corners as well as in bars and special venues called ""tablaos."""
52,Palma de Mallorca,Spain,50,68,40,84,20,31,"Commonly referred to as ""Palma,"" this Spanish city is known as the ""Pearl of the Mediterranean."" Once walled off to protect the city from invasions, only one stretch of the ramparts that once enclosed it remains—Muralla Ses Voltes, which once served as military barracks, is now part of a cultural center with sprawling exhibition space. Also at the formerly fortified port is the Es Baluard Palma Museum of Modern and Contemporary Art, while the uniquely circular Bellver Castle sits high above, at Palma's highest point."
51,Vancouver,Canada,31,86,58,67,11,35,"This British Columbian gem is a must-see when visiting Canada. With the Pacific Ocean, multiple large parks and forests, and three major mountains—all easily accessible, visitors can hike, jog, climb, play, and explore to their hearts' content. Vancouver has also played a large role in both film and television: The city has provided the setting for productions such as the ""Twilight"" saga, the ""Deadpool"" movies, ""Elf,"" ""Night at the Museum,"" ""Riverdale,"" ""Battlestar Galactica,"" and ""Bates Motel,"" just to name a few. For a scenic way of taking in your surroundings, try the Skyride—North America's largest aerial tramway system."
50,Shenzhen,China,55,15,106,45,32,78,"Shenzhen, the closest Chinese city to Hong Kong, is also one of the country's wealthiest. Shenzhen's rise to prominence started in 1979 when China designated the sleepy border town as the country's first special economic zone. What this city lacks in ancient history, it makes up for in innovation and culture. The Splendid China-Folk Culture Villages is a park with replicas of many famous attractions in China that gives visitors an easy glance into the country's long history. Meanwhile, the Window of the World theme park offers replicas of famous attractions from around the world, from Egypt to Greece to Paris to Cambodia."
49,Budapest,Hungary,60,63,61,46,53,34,"Visitors to Hungary's capital city don't have to go far to fall for the city's charms. Fans of art and culture are drawn to Budapest's numerous architectural styles—Baroque, neo-Gothic, and Art Nouveau, just to name a few—and the newly restored 19th-century-era Hungarian State Opera House, which is open for English-language tours daily. Budapest is also home to more than 100 thermal springs—which means it's a great place to relax at one of its many spas and bathhouses, each building a mini-vacation itself. To complete their trip, visitors should also visit the famous Budapest Pinball Museum, called the Flippermúzeum, and have a night out at one or more of the ruin bars in abandoned buildings and courtyards in the Jewish Quarter."
48,Washington DC, United States,10,83,69,53,68,7,"The United States capital is instantly recognized by its historical monuments—the Lincoln Memorial, the Jefferson Memorial, and the Washington Monument, not to mention the White House. But beyond the National Mall and the Capitol Hill area, ""D.C."" also draws tourists to its many museums within the Smithsonian network, including the National Portrait Gallery and the National Museum of Natural History. Perhaps the most beautiful time of year to visit the District of Columbia is spring, when the cherry blossoms are in full bloom. The best place to spot them? The Tidal Basin section of the National Mall."
47,Nice,France,78,43,29,81,45,13,"A sunny, buzzing cultural hub in southeast France, there is no end to activities that people can do in Nice. Located along the French Riviera, Nice is a city of terracotta roofs, excellent dining, beautiful public and private beaches, and museums perfect for history, music, and art buffs. Check out Lascaris Palace to see a fine collection of musical instruments and learn their history enclosed within an architecturally grand palace. End your day watching the sunset from Castle Hill, the highest point in Nice that once housed a former military citadel but is now a must-visit to get the best view of all of Nice."
46,Copenhagen,Denmark,45,79,15,70,49,20,"If you want to explore the best of what the Danish capital has to offer, hop on a bike. Copenhagen's push for greener and healthier living has made it easier to travel on two wheels to any destination within the city's charming and colorful buildings. Perhaps Copenhagen's most interesting attraction that captures its essence is CopenHill, offering visitors the chance to ski, hike, relax, and eat on an artificial slope built atop a waste-to-energy power plant."
45,Guangzhou,China,44,12,102,37,33,79,"Founded in 214 B.C., Guangzhou, China, is a thriving port city whose airport, public transportation, and air quality have all improved significantly over the past two decades. Visitors—including local tourists from elsewhere in the country—are drawn here to trace the history of the Silk Road trade route, see buildings designed by such ""starchitects"" as Zaha Hadid, and take a cruise on the historic 1,243-mile Pearl River. Want to see it all from high above the city? Ascend to the top of the Canton Tower and visit its observation deck at over 1,600 feet."
44,Warsaw,Poland,38,53,87,40,25,32,"Visiting Warsaw is like taking a trip through the city's tumultuous history, as it had gone through many occupations and destructions—most notably in 1944, when Adolf Hitler ordered the city to be virtually leveled after the Warsaw Uprising. Since then, however, Warsaw has been rebuilt and restored, but it still pays homage to its difficult history. Learn about the history of the uprising and the sacrifice of the Polish resistance at the Warsaw Rising Museum, with admission free on Mondays. Visit the POLIN museum, which documents the history of the Jewish community in Poland. Honor the fallen Polish soldiers of World War I and watch the changing of the guard at the Tomb of the Unknown Soldier, active since 1925."
43,Shanghai,China,58,32,96,11,27,92,"One of China's most populated cities, Shanghai is a modern, buzzing financial hub—but it also retains its colonial heritage. The metropolis's location on the Huangpu River allows visitors to see The Bund, Shanghai's impressive cityscape by the waterfront. The 1,614-foot World Financial Center is used for many purposes, including sightseeing, financial operations, fine cuisine, and a hotel."
42,San Francisco, United States,6,81,74,27,81,15,"This Northern California city resting on a peninsula is cool not just in terms of its foggy weather but also in its culture. San Francisco is known for its role in the Gold Rush and the tech industry—but it also offers many other attractions, including Fisherman's Wharf, the oldest Chinatown in the United States, and the former federal prison on Alcatraz Island. Getting around ""Fog City"" could involve climbing steep and sometimes even crooked streets—perhaps via cable car—or crossing the world-famous Golden Gate Bridge. Just beware of earthquakes—like the one that flattened much of the city in 1906."
41,Tel Aviv,Israel,41,20,20,80,69,69,"Tel Aviv, Israel, is a hip, colorful, and modern city that stands out among the more historic, older cities and towns in the country. On the coast of the Mediterranean Sea in the west, Tel Aviv is a hub for art, technology, innovation, and wild nightlife. Tel Aviv is also known for being one of the more LGBTQ+-friendly and progressive cities in the Middle East, with a quarter of its population being part of the community, and hosts a massive Pride parade each year that attracts tourists from all around the world to come to see."
40,Brussels,Belgium,62,38,53,50,52,25,"Beer, waffles, chocolate, and comics are just a few reasons to consider visiting Brussels. It's the capital of Belgium and the headquarters of the European Union and European Parliament, but it's not all serious business and politics. Visitors can enjoy a whimsical and relaxed trip around this city by taking a beer tour through the best and oldest pubs and breweries in town, or follow along the comic book route and try to find as many homages to Franco-Belgian comic art painted on the walls as they can. Finally, in between looking at the fine palaces, cathedrals, and historical museums that appear all over this city, take a moment to gawk at the Manneken Pis. This fountain features a statue of a little boy peeing—sometimes in costume—and is one of the most famous sculptures in Brussels."
39,Stockholm,Sweden,42,50,27,82,38,3,"There is no shortage of things to do in Sweden's capital city, which seamlessly marries the past and the future together. A great example of this is the island of Gamla Stan, or Old Town, where Stockholm was first founded. While you're exploring, take a ""fika"" break—a Swedish tradition that encourages relaxing and socializing with friends and colleagues over coffee and treats—before returning to the hustle and grind of everyday life."
38,Abu Dhabi,United Arab Emirates,39,16,35,75,16,85,"The beautiful capital of the United Arab Emirates has grown into a modern and developed metropolis thanks to the country's vast oil reserves. Abu Dhabi offers visitors luxury while paying homage to the region's rich history and Islamic religion. Explore the beautiful deserts and oases of the region; visit the Sheikh Zayed Grand Mosque, one of the largest in the world and the most architecturally impressive mosque in the country; have a taste of authentic Arabian coffee; go sailing on one of Abu Dhabi's waterfronts; and get your hands and arms painted by famed henna artists to experience this magnificent city to the fullest."
37,Venice,Italy,70,10,22,63,56,64,"Venice is truly a place like no other. The city lies upon 118 small islands, all linked together by canals or bridges—which means the way to get around is either by walking or taking a boat. The city's structure also poses unique problems as its delicate foundation has caused the land to start sinking slowly. Additionally, high tides and strong winds could cause the canals to flood—although, in 2023, the city experienced a drought that kept water levels at bay. Visit St. Mark's Basilica, located on St. Mark's Square and dedicated to the patron saint of Venice, to see a beautiful cathedral with beginnings as far back as 1063. Take a water taxi to some of the smaller islands within the city's network to observe the making of items like glass, gondolas, leather, and lace. Finally, gondola rides can be pricey, but they offer amazing, romantic views of Venice and its lesser-known canals and are a rare experience."
36,Kuala Lumpar,Malaysia,15,51,38,16,91,88,"The Malaysian tourist industry has been on the uptick since 2020—and its capital city, Kuala Lumpur, is one of its most popular destinations. In addition to its mixture of British colonial and Asian architecture, standouts of its skyline are the Petronas Twin Towers—the world's tallest twin structures, which pierce the sky with their matching spires. Other impressive skyscrapers include the 50-story concrete Maybank Tower and the KL Tower, whose observation deck offers a stunning view."
35,Miami,United States,9,26,77,44,83,6,"Miami received the most international arrivals of any U.S. gateway, as of a preliminary 2021 report, after a record-breaking 50.6 million passengers passed through its airport that year. This Florida city attracts tourists for its stunning beaches; vibrant arts district, including the Art Basel art fair, which happens in December and brings in large crowds annually; and its distinct Cuban influence, most notably in the neighborhood Little Havana and Calle Ocho, its main street."
34,Las Vegas,United States,30,18,64,49,67,16,"Las Vegas—also known as Sin City—may mainly be known for its Strip, home to numerous casinos such as Caesars Palace and Aria. However, this popular Nevada city can provide an epic getaway for the entire family, with its iconic hotels, spas, faux reproductions of popular world attractions, and the chance to sit behind the wheel of some of the world's most luxurious cars. Don't be surprised if you encounter a celebrity singer or chef—artists like Lady Gaga and Mariah Carey have performed residencies in Las Vegas, and food legends like Bobby Flay, Guy Fieri, and Gordon Ramsay operate restaurants there."
33,Bangkok,Thailand,43,27,31,14,107,91,"Locals actually know Bangkok as Krung Thep—short for Krung Thep Mahanakhon Amon Rattanakosin Mahinthara Ayuthaya Mahadilok Phop Noppharat Ratchathani Burirom Udomratchaniwet Mahasathan Amon Piman Awatan Sathit Sakkathattiya Witsanukam Prasit— the city's official full name. The Thai capital is yet another old city that is learning how to blend its past and its future—preserving magnificent Buddhist temples, where you'll need to dress appropriately; palaces, like The Grand Palace that is open for visits daily; while also building edgier skyscrapers like the MahaNakhon by German architect Ole Scheeren, completed in 2018."
32,Zurich,Switzerland,29,67,34,58,3,19,"While internationally renowned as a global financial center, Zürich is also home to Switzerland's largest art museum, Kunsthaus Zürich, and a world-class succulent collection, located in the greenhouses of Sukkulenten-Sammlung Zürich. For an entirely different kind of superlative, visit the world's largest Lindt chocolate shop in a stunning modern architectural landmark on Lake Zurich—a popular destination in its own right, mainly for warm-weather recreation like boating. In the winter, Zürich provides easy access to the Swiss Alps for a day trip in the snow."
31,Athens,Greece,40,66,4,25,86,63,"Despite being one of the oldest cities on this list, Athens, Greece, saw tremendous growth in tourism between 2019 and 2023. The country's capital, which offers visitors the chance to see some historical landmarks that they may have only seen in their school textbooks, is unique in how it's lived through nearly every form of government and various styles of architecture throughout its long history. Visit Athens' most famous destination, the Acropolis, a fortified hill that holds most of its iconic landmarks—Parthenon, Temple of Athena Nike, the Theater of Dionysus, just to name a few. The nearby Acropolis Museum houses the artifacts recovered from the hill and is also a must-visit, as are the other ruins of temples speckled through Athens. Finally, take a break from history by visiting the neighborhoods of Monastiraki and Psirri, bustling hubs of fantastic food, shopping, and street art."
30,Toronto,Canada,37,60,52,32,22,26,"Unlike many cities on this list, Toronto's charm lies in the fact that it's a major city—the most populous city in Canada, to be exact. It is also the most diverse city, with half of the population born outside of Canada. Famous destinations in this capital city of Canada's province of Ontario include the CN Tower, offering several vantage points of the surrounding city. Additionally, the Hockey Hall of Fame is a must-see for winter sport fans, as it houses the largest hockey collection in the world—including the actual Stanley Cup—and has been inducting hockey legends for nearly 80 years."
29,Florence,Italy,56,17,19,48,63,48,"Florence shows what Italy is all about, as this Tuscan gem is the birthplace of the Renaissance and is home to famous artwork and architecture, not to mention amazing food and gelato. One of the masterpieces is the Florence Cathedral or Duomo di Firenze, whose main building was completed in 1436, with some exterior parts added in the 19th century. The Duomo is a massive and constantly evolving work of art, usually noticed by its white, pink, and green marble facade; its 52 stained-glass windows; and its massive red-tiled cupola, designed by Filippo Brunelleschi. Other amazing artwork can be found in the Uffizi Palace and Gallery, which hosts an impressive collection of Renaissance artwork, including pieces from Da Vinci, Caravaggio, Botticelli, Raphael, and Michaelangelo."
28,Taipei,Taiwan,2,33,55,28,44,83,"The capital of Taiwan is known for a 1,667-foot landmark called Taipei 101. Resembling a bamboo stalk, it has a high-speed elevator that takes visitors to the 89th-floor observation deck in only 37 seconds. Don't stop here; Taipei offers much more than this speedy elevator ride. Try shopping at its night markets; visiting a national park, museum, or temple; or simply sampling its street cuisine. Another exciting thing to do in Taipei is shrimp fishing, where you catch your own food from small artificial pools and then clean it and grill it."
27,Kyoto,Japan,63,44,5,43,7,67,"If you want to experience more of the traditional side of Japan, Kyoto is your place to go. Comprising over 2,000 Buddhist temples and Shinto shrines, it's not unusual to see someone praying, meditating, or strolling through the many beautiful Zen gardens within these spiritual structures. Get the whole Kyoto experience by checking out the work of local artisans in the Gion district and by choosing to stay at a ryokan, a traditional Japanese inn."
26,Frankfurt,Germany,20,48,49,36,48,5,"Known as ""the gateway to Europe,"" Frankfurt, Germany, connects many travelers to different parts of Europe through the busiest airport in the country. Visit the old town of Römerberg during the holidays to experience its massive Christmas market. Take a trip to the restored Goethe House, where famous writer Johann Wolfgang von Goethe was born. Finally, climb up the Main Tower high rise to see Frankfurt's skyline and the Main River, which have been likened to New York City's Manhattan cityscape and waterfront, from the highest observation point."
25,Orlando,United States,19,6,48,39,82,37,"Orlando is theme park central, with Walt Disney World, Universal Orlando, SeaWorld Orlando, and Legoland—all family-friendly favorites, among many other smaller parks. But Orlando doesn't just offer the magic of Disney and Harry Potter. There is also plenty of fine dining, wonderful spas, cool museums, and relaxing parks to explore if you're just trying to enjoy the Florida sunshine. Drive about 60 minutes east from Orlando to check out the Kennedy Space Center Visitor Complex if you want to pretend to be an astronaut, or travel about 40 miles west of downtown Orlando to Revolution Adventures to engage in some ATV or dune buggy racing through the muddy roads of this adventure park."
24,Melbourne,Australia,49,13,70,34,5,4,"The city center of Melbourne, Australia, and its surrounding suburbs can offer visitors a cool, hipster-like experience, quickly noticeable just by walking down its graffitied, cobblestone streets or through its many flea markets. Melbourne takes two things seriously: coffee and sports. Melbourne has thousands of cafes offering the best quality coffee created in many unique ways—Americans may recognize the now-popular flat white, which has Aussie origins. As for sports, Melbourne is known for cricket, Australian rules football, horse racing, and tennis, just to name a few. The iconic Melbourne Cricket Ground sports stadium, ""The G,"" is a popular destination, especially when the Australian Rules Football League season starts."
23,Istanbul,Turkey,13,25,23,92,98,98,"Istanbul saw a 26% growth in international arrivals in 2023, placing it at the top of Euromonitor's ranking. Most of Turkey's visitors came from Germany, Russia, and Ukraine in 2021—but it's also been attracting the attention of travelers from the Middle East. For a unique Turkish retail experience, the Grand Bazaar is the place to go. It's been around since 1461, so it can be considered the world's oldest shopping center. Take a day to explore the hidden alleys of the bazaar, whose more than 4,000 small businesses offer the opportunity to haggle your way to a deal—and a unique cultural experience."
