22,Sydney,Australia,36,2,71,42,6,17,"Among Australia's largest cities, Sydney is a great place to visit for those looking to have a more laid-back vacation. The stunning Sydney Opera House is an architectural feat—and inside, you'll find myriad performances happening each week. The Sydney Harbour Bridge, nicknamed the ""coat hanger,"" is a structural engineering feat that you can experience up close by booking a ""climb"" experience, which provides the best views of the harbor. If you're looking for day trips, the Blue Mountains or Hunter Valley are the way to go. The Blue Mountains offer amazing hiking trails, and it's worth going up to the peak of these rock formations during sunset. The vineyards of Hunter Valley, located north of Sydney, are perfect for wine lovers—and you can even enjoy a glass of wine while traveling in a hot air balloon over the region."
21,Prauge,Czech Republic,33,31,43,21,54,23,"Prague, the capital of the Czech Republic, also known as Czechia, saw its tourism grow by 28% in 2023, compared to the previous year, with 5.5 million visitors arriving during the first three quarters of the year. With a bohemian appeal and fairy-tale charms, Prague attracts tourists who want to explore its trademark Prague Castle, the home of many former Czech rulers and presidents; enjoy a famous Czech beer; or explore the colorful and whimsical streets of the Old Town and the Golden Lane, where Czech-Jewish writer Franz Kafka notoriously once wrote."
20,Lisbon,Portugal,61,37,25,23,37,14,"As tourism to Portugal surges, especially from the United Kingdom, Germany, France, and the United States, the colorful and architecturally stunning capital city of the southern European country has plenty to offer visitors. Bring comfortable shoes when wandering around Lisbon, as the city is built over seven hills—and navigating its steep and winding roads is not for the faint of heart, despite the beautiful views. Using the city's tram network is a unique and fun way to get around. The most popular tram route is the E28. The 28 trams date back to the 1930s—and their slick designs are the only trams that can navigate through the narrowest Lisbon streets."
19,Los Angeles,United States,3,11,66,19,80,36,"The so-called ""City of Angels"" lures tourists with its mild weather, buzzy nightlife, laid-back vibes, and trademark Santa Monica and Venice beaches. From luxury shopping on Rodeo Drive in Beverly Hills to taking on the winding hiking trails to the famous Hollywood sign or the Griffith Observatory, everyone can find something to do in Los Angeles. Although many tourists want to check the famous Hollywood Walk of Fame off of their lists, they can also veer off the beaten path by checking out Little Tokyo, the largest Japanese ethnic enclave in the United States, or taking a ride on ""the world's shortest railway,"" Angel's Flight."
18,Vienna,Austria,28,36,41,30,41,8,"Vienna gave rise to such great musical minds as Wolfgang Amadeus Mozart, Ludwig van Beethoven, Joseph Haydn, and Franz Schubert—all of whom helped bring attention to this ""city of music."" The baroque streetscapes, holding various imperial palaces, are remnants of the Habsburg royal dynasty. Additionally, the city's exquisite wine culture and casual but essential coffee house culture are already enough to attract visitors. Don't forget to try a slice of Sachertorte, a chocolate-iced chocolate sponge cake with layers of apricot jam in between, which you can find at its birthplace, the Hotel Sacher."
17,Hong Kong,China,8,23,24,33,8,104,"Tourism to Hong Kong is continually bolstered by its proximity to mainland China—even though relations have been particularly tense since 1997, when Britain relinquished control over the territory. Traditionally known for its vibrant shopping centers, especially the Temple Street Night Market, Hong Kong has been focusing on showing off its natural beauty and culture when city life gets too hectic. Visitors can enjoy beautiful beaches, numerous nature reserves, and hiking trails, and they might even get to glimpse Hong Kong's famous but increasingly rare pink dolphins."
16,Osaka,Japan,46,45,11,18,15,57,"Tourists used to overlook Osaka, Japan, flocking instead to the better-known city of Tokyo, but that is slowly starting to change. Osaka is a vibrant, modern city filled with lights, nature, and many great cuisines. Osaka is known as ""Japan's kitchen"" due to its unique dishes, many Michelin-starred restaurants, and amazing street food carts. Once you've had your fill, don't miss Osaka Castle, built in the 1500s by a former feudal lord and one of the city's most important landmarks, surrounded by cherry blossom trees that burst open every spring."
15,Dublin,Ireland,17,57,2,56,2,9,"Ireland's capital is another place with beautiful, centuries-old cathedrals, castles, and museums. However, the way to get into Dublin's culture is to follow the books and booze. Channel your inner James Joyce or Oscar Wilde by exploring Dublin's numerous quaint bookstores and libraries. Check out Marsh's Library, Ireland's first public library that opened in 1707, or the Trinity College Library, the largest library in the country that contains the ancient Book of Kells. Learn more about Ireland's history by booking tours and drinks at the Guinness Storehouse Factory, the Old Jameson Distillery, and the Irish Whiskey Museum, or chat with one of the locals at one of Dublin's many unique and vintage bars."
14,Seoul,South Korea,22,34,21,7,42,90,"Seoul, South Korea, combines aspects of South Korean culture that don't seem to mesh at first—mountain temples and shrines, ornamental palaces, a booming Korean pop and clothing scene, and futuristic neon-lit city streets. The most popular of the palaces is Changdeokgung, built in 1405 and used well into the 20th century, which is surrounded by beautiful secret gardens."
13,Milan,Italy,27,30,18,17,58,53,"Milan might be known as a modern metropolis and the high-end fashion capital of Italy, but the former capital of the Western Roman Empire is several thousand years old. As in Florence, one of the prettiest buildings is a cathedral—the largest Gothic complex in the world, the Duomo di Milano, which took more than 500 years to complete. However, those who want to check out the commercial life of Milan should visit the Galleria Vittorio Emanuele II, one of the oldest shopping malls in the world, built in the mid-19th century, whose architecture reflects the marble, mosaic, and glass style of Milan's other buildings."
12,Munich,Germany,12,22,26,38,50,10,"Munich is ideal for anyone who loves exquisite palaces, historic cathedrals, and great-tasting beer. In fact, Munich's main event every year is Oktoberfest, the world's largest two-week beer festival, attracting millions of visitors between late September and early October. Another fun but unexpected activity for the landlocked capital of Bavaria is river surfing on the waves of the artificial Eisbach river, which is enjoyed by thrill-seekers year-round and attracts many spectators."
11,Singapore,Singapore,1,28,3,35,4,99,"Singapore may be the most expensive city in the world to live in. It tied with Zürich in 2023, but the ""Lion City"" is worth a visit for its beautiful and unusual attractions. Take, for example, its Muslim quarter—the Kampong Gelam historic district, and the Gardens by the Bay, where there's always something blooming, no matter what time of year. You can even wrap up your day at the Night Safari zoo, the first nocturnal wildlife park in the world."
10,London,England,11,24,47,1,35,45,"It's hard to know how much Brexit has contributed to the decline in tourism to London since the United Kingdom officially split with the European Union in 2020, as it coincided with international travel restrictions. But as Britain's cultural, economic, and transportation hub, this capital city has seen a steady stream of European tourists since 2022—despite the added paperwork necessary for some to visit after the landmark ""exit."" Some of the most popular attractions include such historic sites as Buckingham Palace, Westminster Abbey, Big Ben, and the U.K. Parliament—but you can get one of the best views of London from a more contemporary attraction, the London Eye, added to the skyline in 2000."
9,Barcelona,Spain,26,40,13,13,23,38,"The sunny capital of the Catalonia region, Barcelona is still the most popular tourist destination in Spain. There are so many activities to do in this city and places to explore that a single short trip may not be enough. Be sure to take some time and visit all of architect Antoni Gaudí's buildings, including the Sagrada Família, Casa Batlló, Casa Milà, and the pavilions at Park Güell. These architectural feats are unique and show the range of Gaudí's style, as well as influence the work of more contemporary architects and designers."
8,New York,United States,7,5,44,8,84,24,"New York City remains the top city destination in the Western Hemisphere, attracting 56.7 million visitors in 2022. While Manhattan may be the heart of the ""Big Apple"" and is known worldwide as a financial, cultural, and diverse center, the island's four surrounding boroughs each have distinct personalities and attractions. For example, Queens is known for being the most diverse county in the world, with at least 160 languages used daily. The borough of Brooklyn is connected to Manhattan by the landmark Brooklyn Bridge; it is home to the country's oldest performing arts center, the Brooklyn Academy of Music; and Coney Island, ""the birthplace of the American amusement park."""
7,Rome,Italy,53,9,8,4,59,41,"The Italian capital is Europe's fifth most visited city and the origin of the great Roman Empire. In addition to a vibrant street life and decadent cuisine, the Eternal City has been a sacred city for 3,000 years. Among the oldest of the famous Roman buildings is the Colosseum, built between A.D. 70-80; the Pantheon, construction starting in A.D.118; and the Arch of Constantine, built in A.D. 315."
6,Berlin,Germany,59,3,16,12,51,12,"Berlin is a resilient city, as its residents work to overcome the German capital's tumultuous history from the past century. An example is the East Side Gallery, a former portion of the Berlin Wall that has now become a street art collection of murals and political drawings. Closer to the famous Brandenburg Gate lie 2,711 concrete slabs that make up the Holocaust Memorial, where visitors are encouraged to process their thoughts and emotions in their own way."
5,Amsterdam,Netherlands,5,8,12,22,43,28,"The Dutch capital has become a fan-favorite due to its charming canals, colorful townhouses, and numerous bike paths. A must-visit site is the Anne Frank House. Visitors can see the annex where Frank wrote her diary and learn about life in hiding. Additionally, the Van Gogh Museum gives tourists a look into the life of 19th-century painter Vincent van Gogh, who was little-known during his actual lifetime but is now one of the most influential artists in history."
4,Tokyo,Japan,18,21,7,3,12,59,"The bright lights of always-bustling Tokyo make the capital the most popular city in Japan, and there are many reasons to keep visiting, no matter the season—from the Cherry Blossom Festival in April to the beautiful light displays in Tokyo Station, Omotesando, Roppongi Hills, and throughout the city in December. Visitors come to marvel at a concert of people moving from one street to the other at Shibuya Crossing. People watch the colorfully dressed cosplayers at Yoyogi Park or relax in the city at ""onsens,"" or hot spring baths. Among the many popular attractions in Tokyo is Kabukiza, the main theater for the Japanese dance of kabuki, an elaborate performance with dramatic sets, outfits, and makeup."
3,Madrid,Spain,21,42,6,5,18,1,"Madrid is a lively—though old—city with an energetic population. Walking down the street, you're likely to see buildings from the 16th century, built during the peak of the Spanish Empire or even earlier. Fans of soccer, aka football or fútbol, would enjoy a tour around Santiago Bernabéu Stadium, the home of the world-famous and prolific Real Madrid team. If you want to escape the crowded city squares, check out the park El Retiro. This UNESCO World Heritage Site is a great place to relax; go for a jog; rent a bike; go for a boat ride on the park's lake in the summer; or even admire Madrid's oldest tree, which has been alive since 1633."
2,Dubai,United Arab Emirates,4,4,9,15,14,70,"This oasis in the desert is home to some of the world's best hotels, shopping, and increasingly good dining and cultural options. These are just some factors that make Dubai the most popular destination in Africa and the Middle East. Check out Ski Dubai, the world's first indoor ski resort, open year-round in the city's warm climate. The gold and spice souks are large bazaars offering precious jewelry and pungent flavors. Of course, the city's also home to Burj Khalifa, the tallest building in the world, at 2,716 feet above the city."
1,Paris,France,24,1,1,2,47,33,"Even travelers who have never been to the City of Lights have heard about its many landmarks and attractions, such as the unmistakable Eiffel Tower, the beautiful and gigantic Musée du Louvre—the most-visited museum in the world, the Arc de Triomphe, and the Notre-Dame Cathedral, which was devastated by fire in 2019 and lost its wooden roof and spire. People worldwide raised money in support, and this famous landmark closed for renovations until reopening in December 2024."